{"evidence_id":"EVD-1","run_id":"RUN-1","evidence_type":"TEST_RESULT","media_type":"application/json","storage_ref":"evidence/EVD-1.json","content_hash":"sha256:0000000000000000000000000000000000000000000000000000000000000000","byte_length":128,"source":{"kind":"RUNNER","source_id":"EXE-1","command_digest":"sha256:1111111111111111111111111111111111111111111111111111111111111111"},"sanitized":true,"produced_at":"2026-08-05T10:04:00Z"}
